{
  "schema_version": "ghostlight.visual_blockout_plan.v0",
  "blockout_plan_id": "pallas-species-strikes-service-ring-kappa-blockout-v0",
  "fixture_id": "pallas-species-strikes-branch-and-fold-v0",
  "visual_plan_ref": "examples/visual/pallas-species-strikes.branch-and-fold.v0.visual.json",
  "purpose": "Geometry-backed blockout plan for Service Ring Kappa. This is a spatial guide for illustrated IF image references, not a semantic segmentation mask.",
  "layout": {
    "layout_id": "service_ring_kappa",
    "layout_asset": "experiments/blender/pallas-species-strikes/service-ring-kappa.blockout.blend",
    "coordinate_system": "Blender default: Z up. The service lane runs along +Y, manifold wall sits on -X, baseline anchor rail sits on +X, supervisor catwalk is elevated on +X, and the Kappa crawl throat is near +Y.",
    "scale_notes": "One Blender unit is treated as one meter. Human proxies are roughly 1.7-1.9 units tall; Teth's proxy occupies a low horizontal work-support volume roughly 2.4m by 1.4m by 1.1m.",
    "source_refs": [
      "examples/lore-grounding/pallas-species-strikes.awakened-labor.v0.json",
      "examples/visual/pallas-species-strikes.branch-and-fold.v0.visual.json"
    ]
  },
  "semantic_materials": [
    {
      "material_id": "shell_aggregate",
      "display_name": "Bloom shell aggregate",
      "base_color": [
        0.28,
        0.25,
        0.22,
        1
      ],
      "intended_read": "Curved engineered habitat shell built from consolidated asteroid rubble/aggregate and dark TCS substrate.",
      "use_in_prompt": "Treat as rough engineered inner shell, not a solid natural asteroid cave."
    },
    {
      "material_id": "manifold_amber",
      "display_name": "Amber manifold wall",
      "base_color": [
        1,
        0.55,
        0.08,
        1
      ],
      "intended_read": "Pipe-and-panel manifold wall with route screens, valves, pressure gauges, and diagnostic touch panels.",
      "use_in_prompt": "Preserve location and broad amber industrial glow; imagegen may reinterpret material detail."
    },
    {
      "material_id": "anchor_orange",
      "display_name": "Baseline anchor rail",
      "base_color": [
        0.95,
        0.32,
        0.08,
        1
      ],
      "intended_read": "Bolted rail, hooks, tethers, and baseline rigger work zone.",
      "use_in_prompt": "Preserve rail side, hooks, and worker blocking."
    },
    {
      "material_id": "supervisor_blue",
      "display_name": "Supervisor catwalk and screens",
      "base_color": [
        0.15,
        0.42,
        1,
        1
      ],
      "intended_read": "Raised open supervisor catwalk with waist-high transparent safety rail and blue-white management displays.",
      "use_in_prompt": "Preserve elevation, open catwalk geometry, and blue authority-screen field."
    },
    {
      "material_id": "crawl_red",
      "display_name": "Kappa crawl throat",
      "base_color": [
        0.95,
        0.06,
        0.04,
        1
      ],
      "intended_read": "Dark gasket-rimmed crawl opening and red-alert focal hazard.",
      "use_in_prompt": "Preserve as circular/oval tunnel mouth with red warning emphasis."
    },
    {
      "material_id": "teth_blue_gray",
      "display_name": "Teth cephalopod body proxy",
      "base_color": [
        0.1,
        0.26,
        0.36,
        1
      ],
      "intended_read": "Cephalopod body volume: horizontal mantle and tentacle reach.",
      "use_in_prompt": "Preserve nonhuman horizontal body volume; do not reinterpret as a humanoid in a chair."
    },
    {
      "material_id": "support_rig_steel_blue",
      "display_name": "Open cephalopod work-support rig",
      "base_color": [
        0.42,
        0.56,
        0.62,
        1
      ],
      "intended_read": "Low open dry-operation support sled, soft pad, side rails, contact arcs, oxygenation tubes, and reachable tool rail.",
      "use_in_prompt": "Preserve as workplace support equipment around the cephalopod body, not a tank, cage, or restraint chair."
    },
    {
      "material_id": "callback_ivory",
      "display_name": "Aftermath callback objects",
      "base_color": [
        0.88,
        0.82,
        0.68,
        1
      ],
      "intended_read": "Small handled objects: mug, parts tray, tagged limiter interface, repaired contact band, and spare oxygenation tube.",
      "use_in_prompt": "Use only as visible object callback staging, not as social-state training data."
    },
    {
      "material_id": "worker_gray",
      "display_name": "Engineered seal technicians",
      "base_color": [
        0.55,
        0.58,
        0.58,
        1
      ],
      "intended_read": "Clean gray engineered-worker skinsuits and coordinated line posture.",
      "use_in_prompt": "Preserve approximate worker cluster placement; do not rely on color as a model-readable label."
    },
    {
      "material_id": "rigger_brown_orange",
      "display_name": "Baseline anchor riggers",
      "base_color": [
        0.62,
        0.28,
        0.1,
        1
      ],
      "intended_read": "Patched brown-orange baseline rigger jackets, hooks, gloves, and magnetic boots.",
      "use_in_prompt": "Preserve rigger cluster near anchor rail."
    }
  ],
  "geometry_modules": [
    {
      "module_id": "curved_service_lane_shell",
      "object_class": "room_shape",
      "script_ref": "scripts/blender/build_visual_blockout.py",
      "geometry_script_tree": "service_ring_shell",
      "parameters": {
        "length": 18,
        "radius": 4.2,
        "arc_degrees": 130,
        "rib_count": 18,
        "half_width": 3.35,
        "knee_height": 1.05,
        "crown_height": 3.25,
        "arch_steps": 20
      },
      "material_id": "shell_aggregate",
      "notes": "Curved shell, deck floor, support ribs, and overhead pipe spine."
    },
    {
      "module_id": "kappa_crawl_throat",
      "object_class": "cutout_proxy",
      "script_ref": "scripts/blender/build_visual_blockout.py",
      "geometry_script_tree": "crawl_throat",
      "parameters": {
        "position": [
          0,
          8.2,
          1.15
        ],
        "radius": 1.15,
        "depth": 0.35
      },
      "material_id": "crawl_red",
      "notes": "Visible oval tunnel mouth; boolean cutting can be added after the first blockout."
    },
    {
      "module_id": "manifold_wall",
      "object_class": "prop_cluster",
      "script_ref": "scripts/blender/build_visual_blockout.py",
      "geometry_script_tree": "manifold_wall",
      "parameters": {
        "position": [
          -3,
          1,
          1.25
        ],
        "length": 11,
        "pipe_count": 8,
        "panel_count": 6
      },
      "material_id": "manifold_amber",
      "notes": "Repeated pipes, rectangular panels, valve disks, and screen blocks on the -X wall."
    },
    {
      "module_id": "baseline_anchor_rail",
      "object_class": "prop_cluster",
      "script_ref": "scripts/blender/build_visual_blockout.py",
      "geometry_script_tree": "anchor_rail",
      "parameters": {
        "position": [
          2.9,
          0,
          0.55
        ],
        "length": 12,
        "hook_count": 5
      },
      "material_id": "anchor_orange",
      "notes": "Bolted rail with hook proxies and tethers on the +X side."
    },
    {
      "module_id": "supervisor_catwalk",
      "object_class": "elevated_platform",
      "script_ref": "scripts/blender/build_visual_blockout.py",
      "geometry_script_tree": "supervisor_catwalk",
      "parameters": {
        "position": [
          2.55,
          3.2,
          1.55
        ],
        "length": 6.5,
        "width": 0.95,
        "rail_height": 0.65
      },
      "material_id": "supervisor_blue",
      "notes": "Open elevated platform, transparent safety rail proxy, and blue screen slabs."
    },
    {
      "module_id": "cephalopod_work_support_station",
      "object_class": "species_affordance_prop",
      "script_ref": "scripts/blender/build_visual_blockout.py",
      "geometry_script_tree": "cephalopod_work_support_station",
      "parameters": {
        "position": [
          1.75,
          4.7,
          0.44
        ],
        "width": 2.5,
        "depth": 1.6,
        "height": 0.82
      },
      "material_id": "support_rig_steel_blue",
      "notes": "Open work-support frame with contact-band arcs, oxygenation tubes, and radial tool rails."
    },
    {
      "module_id": "object_callback_props",
      "object_class": "small_prop_cluster",
      "script_ref": "scripts/blender/build_visual_blockout.py",
      "geometry_script_tree": "object_callback_props",
      "parameters": {
        "position": [
          1.05,
          5.85,
          0.72
        ]
      },
      "material_id": "callback_ivory",
      "notes": "Small aftermath prop cluster: mug, repaired contact band, oxygenation tube, limiter interface, and parts tray."
    }
  ],
  "proxy_actors": [
    {
      "actor_id": "lio_vale",
      "visual_ref": "visual_character_refs.characters.lio_vale",
      "proxy_shape": "humanoid_capsule_with_slate",
      "material_id": "worker_gray",
      "default_position": [
        0,
        3.2,
        0
      ],
      "default_rotation": [
        0,
        0,
        0
      ],
      "scale": [
        0.5,
        0.35,
        1.75
      ],
      "notes": "Center-lane organizer proxy with small slate block."
    },
    {
      "actor_id": "ilya_marne",
      "visual_ref": "visual_character_refs.characters.ilya_marne",
      "proxy_shape": "humanoid_capsule_supervisor",
      "material_id": "supervisor_blue",
      "default_position": [
        2.55,
        3.4,
        1.6
      ],
      "default_rotation": [
        0,
        0,
        -1.5708
      ],
      "scale": [
        0.38,
        0.28,
        1.05
      ],
      "notes": "Elevated on catwalk, visible above waist rail."
    },
    {
      "actor_id": "nara_7",